[
  {
    "account_id": "ALT-001",
    "name": "High-Growth Tech",
    "type": "stock",
    "currency": "USD",
    "broker": "Morgan Stanley",
    "opened_date": "2024-01-05",
    "holdings": [
      {
        "ticker": "TSLA",
        "shares": 1000,
        "avg_cost": 185.0,
        "current_price": 170.5
      },
      {
        "ticker": "AMZN",
        "shares": 1500,
        "avg_cost": 145.0,
        "current_price": 180.2
      },
      {
        "ticker": "GOOGL",
        "shares": 1200,
        "avg_cost": 130.0,
        "current_price": 155.4
      }
    ]
  },
  {
    "account_id": "ALT-002",
    "name": "Real Estate & Energy",
    "type": "stock",
    "currency": "USD",
    "broker": "Schwab",
    "opened_date": "2024-01-10",
    "holdings": [
      {
        "ticker": "O",
        "shares": 2500,
        "avg_cost": 55.0,
        "current_price": 52.8
      },
      {
        "ticker": "XOM",
        "shares": 1800,
        "avg_cost": 102.0,
        "current_price": 118.4
      },
      {
        "ticker": "NEE",
        "shares": 2000,
        "avg_cost": 60.0,
        "current_price": 68.1
      }
    ]
  },
  {
    "account_id": "ALT-003",
    "name": "Yield Maximizer",
    "type": "bond",
    "currency": "USD",
    "broker": "Vanguard",
    "opened_date": "2024-01-15",
    "holdings": [
      {
        "ticker": "JNK",
        "description": "SPDR Bloomberg High Yield Bond ETF",
        "shares": 5000,
        "avg_cost": 92.5,
        "current_price": 94.8,
        "yield_pct": 6.75,
        "duration_years": 3.8
      },
      {
        "ticker": "AGG",
        "description": "iShares Core U.S. Aggregate Bond ETF",
        "shares": 4000,
        "avg_cost": 98.0,
        "current_price": 97.4,
        "yield_pct": 4.12,
        "duration_years": 6.2
      }
    ]
  },
  {
    "account_id": "ALT-004",
    "name": "Strategic Cash",
    "type": "cash",
    "currency": "USD",
    "broker": "Fidelity",
    "opened_date": "2024-01-02",
    "holdings": [
      {
        "ticker": "FDRXX",
        "description": "Fidelity Government Cash Reserves",
        "shares": 250000.0,
        "avg_cost": 1.0,
        "current_price": 1.0,
        "yield_pct": 4.95
      }
    ]
  }
]